{
  "event": "check_issues:dismiss",
  "message": "john.smith dismissed check issue \"Translation exceeds the maximum number of allowed characters\" on key \"homepage.title\" in locale German (de) in project Translation Project",
  "sent_at": "2025-02-07 16:44:04 UTC",
  "user": {
    "id": "24b9a53ad72e198ca332fba91bb95f57",
    "username": "john.smith",
    "name": "John Smith",
    "gravatar_uid": "1bc5edb4799fd8eec67c66122f47eb73"
  },
  "project": {
    "id": "b2abd3bd2c23ff0ac546e0a2d9aa0be1",
    "name": "Translation Project",
    "slug": "translation-project",
    "main_format": "yml",
    "project_image_url": null,
    "created_at": "2025-02-07 16:18:13 UTC",
    "updated_at": "2025-02-07 16:18:13 UTC",
    "point_of_contact": null
  },
  "branch": {
    "name": "new-feature-1"
  },
  "check_issue": {
    "id": "a1b2c3d4e5f6a1b2c3d4e5f6a1b2c3d4",
    "check_name": "translation_content_length",
    "state": "dismissed",
    "description": "Translation exceeds the maximum number of allowed characters by 12 characters (content is 42 characters, limit is 30)",
    "dismissed_at": "2025-02-07 16:44:04 UTC",
    "solved_at": null,
    "created_at": "2025-02-07 16:18:13 UTC",
    "updated_at": "2025-02-07 16:44:04 UTC",
    "translation": {
      "id": "68740d06f87390fd357f12e0d7ddb9a2",
      "content": "Willkommen auf unserer brandneuen Startseite mit allen Neuigkeiten",
      "unverified": true,
      "excluded": false,
      "plural_suffix": null,
      "created_at": "2025-02-07 16:18:13 UTC",
      "updated_at": "2025-02-07 16:18:13 UTC",
      "key": {
        "id": "24b9a53ad72e198ca332fba91bb95f57",
        "name": "homepage.title",
        "plural": false,
        "use_ordinal_rules": false,
        "data_type": null,
        "tags": []
      },
      "locale": {
        "id": "9c1a2b3c4d5e6f708192a3b4c5d6e7f8",
        "name": "German (de)",
        "code": "de"
      }
    }
  }
}
